Text;;;
"Una Nazionale bella, coraggiosa ed entusiasmante. 
Il sogno continua ???? https://t.co/sf1ArScOxG";;;
"Forse stai pensando “Vai avanti tu…"". Il vaccino è la cosa più importante che puoi fare ora per te e per i tuoi cari.
Con il vaccino #vinciamoinsieme.  Riprendiamoci il #gustodelfuturo https://t.co/oNcjzDU5GY";;;
"RT @sanchezcastejon : Raffaella Carrà fue una mujer que inspiró a varias generaciones felicidad, valentía y compromiso. Su música nos alegró el corazón, su espíritu libre nos llenó el alma.

Descansa en paz, querida #RaffaellaCarrà.
https://t.co/ilKFhaq1Ob";;;
La sua risata e la sua generosità hanno accompagnato generazioni di italiani e portato il nome dell’Italia nel mondo. Agli amici e ai nipoti vanno le più sentite condoglianze di tutto il Governo.;;;
Il Presidente Draghi ha appreso con profonda tristezza della scomparsa di #RaffaellaCarrà. Con il suo talento e la sua professionalità ha avuto un ruolo decisivo nel diffondere la cultura dello spettacolo in Italia.;;;
"#Agenda ???  #5luglio Il Presidente Draghi alle ore 15.00 partecipa in videoconferenza al Vertice del ""Processo di Berlino"" sui #BalcaniOccidentali https://t.co/G6Z0PlplV5";;;
"Il Presidente Draghi incontra a Palazzo Chigi il Presidente del Consiglio della Repubblica dell’Iraq @MAKadhimi 
Diretta https://t.co/u2x07KyyXJ";;;
Dal 1° luglio al 31 dicembre 2021 è possibile richiedere l’#AssegnoTemporaneo per i genitori con figli minori a carico che non hanno diritto all’assegno per il nucleo familiare. Sul sito dell’@INPS_it tutte le informazioni https://t.co/hwJmlBfp6h;;;
#AccademiaLincei Draghi: Per l’Italia questo è un momento favorevole per coniugare efficienza con equità, crescita con sostenibilità, tecnologia con occupazione. È un momento in cui torna a prevalere il #gustodelfuturo. Viviamolo appieno, con determinazione e con solidarietà;;;
Draghi: Dobbiamo ragionare su come permettere agli Stati Membri di emettere debito sicuro per stabilizzare le economie in caso di recessione. La riforma del Patto di Stabilità è l’occasione per farlo. Una risposta credibile migliorerebbe la capacità di rispondere alle crisi;;;
Draghi: Il nostro Paese è il principale beneficiario di #NextGenerationEU e ha un’enorme responsabilità per la sua riuscita. Se sapremo utilizzare queste risorse in maniera produttiva e con onestà non aiuteremo solo l’economia italiana, rafforzeremo anche la fiducia nell'Ue;;;
#AccademiaLincei Draghi: Dobbiamo migliorare la partecipazione al mercato del lavoro di giovani e donne. Non si può avere coesione sociale senza crescita, non si può avere crescita senza coesione sociale;;;
#AccademiaLincei Draghi: I prossimi passi sono la riforma della giustizia civile, della concorrenza e degli appalti. Vogliamo ricreare un clima di fiducia tra Stato e imprenditori, perché i privati scelgano di investire in Italia più di quanto fatto negli ultimi anni;;;
#AccademiaLincei Draghi: Dobbiamo raggiungere tassi di crescita più elevati e sostenibili per aiutare chi non aveva un lavoro prima della pandemia, chi lo ha perso in questi mesi e chi potrebbe perderlo nei prossimi anni;;;
Draghi: Il debito può rafforzarci, se miglioriamo il benessere del Paese. Ci può rendere più fragili se le risorse vengono sprecate. Può unirci, se aiuta a raggiungere l’obiettivo di prosperità sostenibile. Ma ci può anche dividere se solleva lo spettro dell’azzardo morale;;;
#AccademiaLincei Draghi: Oggi è giusto indebitarsi, ma questo non è sempre vero. Questo mi porta alla distinzione tra quello che chiamo “debito buono” e quello che chiamo “debito cattivo”. Ciò che rende il debito buono, o cattivo, è l’uso che si fa delle risorse impiegate;;;
#AccademiaLincei Draghi: L’economia italiana ha operato al di sotto del suo potenziale, c’è molto spazio per politiche di bilancio espansive. La Commissione prevede un aumento del Pil quest’anno in Italia del 4,2%. Credo che verranno riviste al rialzo in maniera significativa;;;
#AccademiaLincei Draghi: Dobbiamo fronteggiare l’emergere di nuove pericolose varianti del virus. Siamo pronti a intervenire con convinzione nel caso ci fosse un aggravarsi della pandemia tale da provocare danni all’economia del Paese;;;
#AccademiaLincei Draghi: La pandemia non è finita. Anche quando lo sarà, avremo a lungo a che fare con le sue conseguenze. Una di queste è il debito. La crisi economica iniziata lo scorso anno non ha precedenti nella storia recente;;;
#AccademiaLincei Draghi: A più di un anno dall’esplosione della crisi sanitaria, possiamo pensare al futuro con maggiore fiducia. La #campagnavaccinale procede spedita. Abbiamo ripreso gran parte delle nostre interazioni sociali. L’economia e l’istruzione sono ripartite https://t.co/AK6IySe2wB;https://pbs.twimg.com/media/E5OKSXwWEAQ6h_0.jpg;https://pbs.twimg.com/media/E5OKTOeXMAUDj6R.jpg;
"Il Presidente Draghi interviene all’Adunanza solenne di chiusura dell’anno accademico dell’Accademia Nazionale dei Lincei. 
In diretta https://t.co/InJPpwd92g";;;
Il comunicato stampa del Consiglio dei Ministri n. 26 https://t.co/Jp8afXqmde;;;
#Agenda ??? Giovedì #1luglio, alle ore 11, il Presidente Draghi interverrà all’Adunanza solenne di chiusura dell’anno accademico dell’Accademia nazionale dei Lincei;;;
Si è conclusa la riunione del Consiglio dei Ministri n. 26 #30giugno;;;
È iniziata a Palazzo Chigi la riunione del Consiglio dei Ministri n. 26 #30giugno;;;
"#Agenda ??? #30giugno Il Consiglio dei Ministri è convocato per oggi alle ore 16.
Qui l'ordine del giorno??
https://t.co/znIQ06nPDz";;;
Intesa sul lavoro tra Governo e parti sociali nella riunione a Palazzo Chigi: il Presidente Draghi e il ministro @AndreaOrlandosp hanno firmato l'avviso comune sottoscritto insieme da Cgil, Cisl, Uil, Confindustria, Alleanza delle Cooperative, Confapi https://t.co/piJ0fy5CuA;;;
"Conferenza stampa del Presidente Draghi al termine del Consiglio europeo #EUCO e dell'#Eurosummit
In diretta da Bruxelles https://t.co/rC1eDJ1IA8";;;
"#Agenda ??? #24giugno Il Presidente Draghi è a Bruxelles per partecipare al Consiglio europeo #EUCO e alla riunione dell’#Eurosummit. 
Qui il programma ?? https://t.co/Ll4mPFYloJ";;;
Il comunicato stampa del Consiglio dei Ministri n. 25 ??https://t.co/fzsKmXh0Z2;;;
"L'Italia riparte. Grazie al #vaccino riabbracciamo il futuro. Completiamo tutti il nostro ciclo vaccinale e vinciamo insieme.
Riprendiamoci il #gustodelfuturo. https://t.co/oJSe2XZyvU";;;
È in corso a Palazzo Chigi la riunione del Consiglio dei Ministri n. 25. Qui l'ordine del giorno ?? https://t.co/7xkpmJcnwI;;;
Hate, intolerance and discrimination have no place in our Union. That's why, today and every day, we stand for diversity and LGBTI equality so that our future generations can grow up in a Europe of equality and respect. https://t.co/a7LuZX8M3E;;;
"La replica del Presidente Draghi in seguito alla discussione generale sulle Comunicazioni in vista del Consiglio europeo del 24 e 25 giugno #EUCO
In diretta dal Senato della Repubblica https://t.co/Hdh9kT7EYf";;;
Consiglio europeo del 24 e 25 giugno: in diretta dal Senato le Comunicazioni del Presidente Draghi https://t.co/P3uYXX0Paj;;;
#Euco, Draghi alla Camera: Il Consiglio promuova un’azione più incisiva sui rimpatri e favorisca un impegno comune a sostegno dei corridoi umanitari.  Occorre uno specifico impegno dell’UE per la stabilità in Libia, auspicabilmente sotto gli auspici dell'#Onu.;;;
#Euco, Draghi alla Camera: Tra i Paesi dell’UE ampia convergenza sull’esigenza di superare il Regolamento di Dublino. Nessun Paese sia lasciato solo. Intendiamo intensificare partenariati e forme di collaborazione con i Paesi di origine e di transito;;;
#Euco, Draghi alla Camera: Il Governo vuole gestire l’immigrazione in modo equilibrato, efficace e umano. Questa gestione non può essere soltanto italiana, deve essere davvero europea;;;
#Euco, Draghi alla Camera: Al #GlobalHealthSummit, la Presidente @vonderleyen ha presentato l’iniziativa europea per la produzione locale e l’accesso ai vaccini, ai farmaci e alle tecnologie sanitarie nel continente africano. È un’iniziativa che l’Italia appoggia con convinzione;;;
#Euco, Draghi alla Camera: Oggi possiamo dirci ragionevolmente ottimisti. La campagna vaccinale ci sta permettendo di contenere in maniera efficace la pandemia. #NextGenerationEU ci fa guardare con fiducia a una stagione di riforme e investimenti;;;
#Euco, Draghi alla Camera: Tutti i Paesi dell'UE si sono impegnati a donare almeno 100 mln di dosi di #vaccini entro fine anno. L’Italia farà la sua parte e ne donerà 15 mln. Migliorare l’accesso ai vaccini nei Paesi più poveri è una questione etica e una priorità sanitaria;;;
#Euco, Draghi alla Camera: Gli occhi dell’Europa sono sull’Italia. Il #PNRR #ItaliaDomani è il programma più di sostanza, più grande. Il successo di #NextGenerationEU dipende in larga parte da noi;;;
#Euco, Draghi alla Camera: Durante la pandemia abbiamo protetto la capacità produttiva, i posti di lavoro, le persone. Ora si tratta di proteggere la crescita della domanda;;;
#Euco, Draghi alla Camera: La situazione economica europea e italiana è in forte miglioramento. La #fiducia sta tornando come dicono gli ultimi dati su #imprese e #consumatori. È fondamentale mantenere a livello europeo una politica di bilancio espansiva nei prossimi mesi;;;
#Euco, Draghi alla Camera: Sono qui per rendervi partecipi dei temi in agenda al prossimo Consiglio europeo. L’interlocuzione con il Parlamento è essenziale per definire la nostra posizione su temi rilevanti per la vita dei cittadini e delle istituzioni https://t.co/kvwqeCZOcp;;;
In diretta la replica del Presidente Draghi alla Camera in seguito alla discussione sulle Comunicazioni in vista del Consiglio europeo del 24 e 25 giugno https://t.co/mze3tsqEWy;;;
"In diretta le Comunicazioni del Presidente Draghi alla Camera in vista del Consiglio europeo del 24 e 25 giugno 
https://t.co/rJPaWRKfZV";;;
#Agenda ??? #23giugno Il Presidente Draghi interverrà alle ore 9.00 alla Camera dei Deputati e alle ore 15.00 al Senato della Repubblica per le Comunicazioni in vista del Consiglio europeo del 24 e 25 giugno;;;
#ItaliaDomani Draghi: Oggi, alla fine della più grande recessione dalla Seconda Guerra Mondiale, con l’approvazione del #PNRR celebriamo quella che spero sia l’alba di una ripresa significativa e duratura dell’economia italiana con al centro #inclusionesociale e sostenibilità;;;
#ItaliaDomani Draghi: Una parte di questi fondi sarà destinata al rilancio della Fondazione Centro Sperimentale di Cinematografia e per formare nuovi giovani che lavorano o lavoreranno nel settore audiovisivo;;;
#ItaliaDomani Draghi: Sono molti i progetti e cantieri pronti a partire. Il settore cinematografico e audiovisivo è stato molto colpito dalla pandemia. Con il #PNRR investiamo 300 mln in studi, teatri, tecnologie digitali e valorizzazione del patrimonio documentale di #Cinecittà;;;
#ItaliaDomani Draghi: La sfida più importante è l’attuazione del #PNRR per assicurarci che i fondi, di cui dovremmo ricevere la prima tranche di 24,89 miliardi di euro questa estate, siano spesi tutti ma soprattutto spesi bene, in maniera efficace, efficiente e con onestà;;;
#PNRR Draghi: Il Piano #ItaliaDomani dà un impulso decisivo alla #TrasformazioneDigitale e alla #TransizioneEcologica. Contribuisce a colmare i divari territoriali e a rafforzare la #coesionesociale. Scommette in maniera convinta su #donne e #giovani per il rilancio del Paese;;;
#PNRR Draghi: Il Piano #ItaliaDomani risponde in pieno alle priorità stabilite dalla Commissione. Lo conferma il giudizio molto positivo arrivato nei tempi che auspicavamo;;;
#ItaliaDomani Draghi: Grazie alla Presidente @vonderleyen, la sua visita segna l’approvazione della Commissione al #PNRR, un ambizioso piano di riforme e investimenti per un'Italia più giusta, competitiva, sostenibile nella crescita. È una giornata di orgoglio per il nostro Paese https://t.co/jWbdhe6oUY;;;
"RT @vonderleyen : Via libera al piano italiano di ripresa e resilienza da 191.5 miliardi di euro!

#NextGeneration è il piú grande piano di rilancio della storia europea. L’Italia ne riceverà la quota piú grande.

Oggi mettiamo la forza della nostra Unione al servizio della ripresa italiana.";;;
#ItaliaDomani #PNRR In diretta la conferenza stampa del Presidente Draghi e della Presidente della Commissione Europea @vonderleyen https://t.co/DAxEwcAmpw;;;
"#Agenda ??? #22giugno Il Presidente Mario Draghi incontra la Presidente della Commissione Europea @vonderleyen in occasione dell’approvazione del #PNRR #ItaliaDomani 
Qui il programma ?? https://t.co/QBNbkX4XLb";;;
In diretta da Berlino la conferenza stampa del Presidente del Consiglio Draghi e della Cancelliera della Repubblica Federale di Germania, Angela Merkel https://t.co/YHcbn3WAM6;;;
#WPLSummit21 Draghi: Appoggiamo fermamente l’impegno di @WPLeadersOrg, vogliamo aiutare le leader femminili in tutto il mondo a favorire l’emancipazione di altre donne. Questo è un nostro dovere nei confronti di milioni di giovani donne e della nostra società nel suo complesso;;;
#WPLSummit21 Draghi: Il nostro obiettivo in Italia è quello di investire entro il 2026 almeno 7 miliardi per la promozione dell’uguaglianza di genere. Ad agosto come #G20Italy terremo una conferenza ministeriale sull’emancipazione femminile per la prima volta nella storia del G20;;;
#WPLSummit21 Draghi: Dobbiamo assicurare la parità di condizioni nel mercato del lavoro e colmare il divario di retribuzione tra i generi, aumentando il numero di donne in posizioni di responsabilità;;;
#WPLSummit21 Draghi: Promuovere la parità di accesso e di opportunità nell’ambito educativo deve essere la nostra priorità. Dobbiamo lottare contro gli stereotipi di genere ed aumentare il numero di ragazze che scelgono di studiare le discipline scientifiche a scuola;;;
"#WPLSummit21 Draghi: Ogni giorno milioni di ragazze devono subire discriminazioni, a volte anche violente, solo perché donne. Questo è immorale, ingiusto e miope. La riduzione delle disuguaglianze di genere deve essere una priorità a livello globale
https://t.co/B40KtFq4Wn";;;
#WPLSummit21 Draghi: We firmly support the commitment made by @WPLeadersOrg to establish a strong network of international women. We want to help female leaders around the world empower other women. We owe it to millions of girls and to our society as a whole;;;
#WPLSummit21 Draghi: In Italy, we aim to invest at least 7 billion euros until 2026 to promote gender equality. In August, as #G20Italy, we will hold a Ministerial Conference on Women’s Empowerment, it is the first in G20 history;;;
#WPLSummit21 Draghi: We need to create a level playing field when it comes to the job market.We must close the gender pay gap and raise the number of women in leadership positions;;;
#WPLSummit21 Draghi: Our priority must be to promote equal access and opportunities in education. We must counter gender stereotypes and increase the rate of female enrolment in scientific subjects at school;;;
#WPLSummit21 Draghi: Every day, millions of young girls are discriminated against, sometimes violently. Just because they are women. This is not only immoral and unfair. It is also short-sighted. Reducing gender inequalities must be a global priority https://t.co/vaJM5ROihg;;;
In diretta il videomessaggio del Presidente Draghi al ‘Women political leaders Summit 2021’ @wpleadersorg #WPLSummit21 https://t.co/ej8DV7DMtT;;;
Il Presidente Draghi ha incontrato oggi a Palazzo Chigi il Vicepresidente di Forza Italia @Antonio_Tajani. Durante il colloquio sono stati affrontati temi legati alla ripresa economica in atto e agli ultimi incontri internazionali;;;
#Agenda ??? #21giugno Il Presidente Draghi alle ore 18 incontrerà a Berlino la Cancelliera Angela Merkel. A seguire la conferenza stampa congiunta https://t.co/v3uwp8WYb0;;;
Conferenza stampa, Draghi: È straordinario come la popolazione non mostri l'intenzione di diminuire la #vaccinazione e di non vaccinarsi. Rispetto ad altri Paesi, è uno dei comportamenti più ammirevoli. Ringrazio tutti gli italiani.;;;
Conferenza stampa, Draghi: L'#eterologa funziona, io sono prenotato per martedì. Vaccinarsi è fondamentale. La cosa peggiore che si può fare è non vaccinarsi o vaccinarsi con una dose sola;;;
Conferenza stampa, Draghi: Non c’è motivo di temere un rallentamento della #campagnavaccinale. Anzi, ci sarà una maggiore libertà di scelta;;;
"Conferenza stampa del Presidente Draghi con il Ministro Speranza e il Commissario Figliuolo 
In diretta da Palazzo Chigi https://t.co/IClCTnC27c";;;
Foro di Dialogo  ????????, Draghi: Italia e Spagna condividono la stessa visione del futuro, intendiamo rafforzare il modello sociale europeo per renderlo all’altezza delle sfide. Dobbiamo costruire società più sostenibili, più innovative ed eque. Possiamo e dobbiamo farlo insieme;;;
Foro di Dialogo  ????????, Draghi: La #transizioneverde, oltre ad essere un obbligo morale verso le generazioni più giovani e quelle future, presenta grandi opportunità di sviluppo. Investire nella #sostenibilitàambientale significa aiutare la crescita economica e l’occupazione;;;
Foro di Dialogo ????????, Draghi: Insieme agli altri Stati Membri vogliamo costruire un’Unione europea più moderna, competitiva e solidale. Che superi le tradizionali divisioni tra Nord e Sud, e si mostri unita nel confronto con le altre potenze globali del nostro tempo;;;
Foro di Dialogo  ????????, Draghi: Italia e Spagna sono i principali beneficiari del #NextGenerationEU. Ma i #Pnrr non sono un insieme di numeri, obiettivi e scadenze. Sono emblematici di un’idea condivisa. Ora dobbiamo riscoprire il #gustodelfuturo. “Insieme siamo più forti” https://t.co/qGGPjZFoG8;https://pbs.twimg.com/media/E4LXvd9XIAMcDNj.jpg;https://pbs.twimg.com/media/E4LXvfVXEAUGPch.jpg;
A #Barcellona lungo e cordiale incontro tra Draghi e @sanchezcastejon sulla situazione economica europea, l’immigrazione e l’agenda multilaterale dei due Paesi. I Presidenti hanno concordato di rafforzare i rapporti tra Italia e Spagna nel processo di integrazione europea https://t.co/G9JrsC3erL;https://pbs.twimg.com/media/E4LDRcUWEAQelPq.jpg;https://pbs.twimg.com/media/E4LDSdzXIAgAXv0.jpg;
"Il Presidente Mario Draghi interviene al Foro di dialogo italo-spagnolo insieme al Presidente del Governo di Spagna @sanchezcastejon ???????? 
In diretta https://t.co/WI1rksCKib";;;
Congratulations to @antonioguterres for his re-election as UN Secretary General. Italy looks forward to keep working with you and the @UN to tackle global challenges through multilateralism and international cooperation;;;
"Il Presidente Draghi interviene al ""Cercle d’Economia"" in occasione del conferimento del ""Premio per la costruzione europea"" #2021RCE @CdEconomia
In diretta da Barcellona https://t.co/BOLbhQTimu";;;
Draghi: Sono molto addolorato per la morte di Adil Belakhdim. È necessario che si faccia subito luce sull’accaduto;;;
"#Agenda ??? #18giugno Il Presidente Mario Draghi sarà a Barcellona dove riceverà il ""Premio per la costruzione europea"" del Cercle d’Economia e parteciperà al Foro di dialogo italo-spagnolo con il Presidente del Governo di Spagna @sanchezcastejon 
https://t.co/SKLGZe5vKU";;;
Il comunicato stampa del Consiglio dei Ministri n. 24 ?? https://t.co/tlgyx9tmyd;;;
Per maggiori informazioni sulla #CertificazioneVerde COVID-19, consulta il sito dedicato?? https://t.co/c2g6F0amSJ oppure chiama il numero verde 800.91.24.91, tutti i giorni dalle ore 8.00 alle ore 20.00;;;
Nei casi di tampone negativo la Certificazione sarà generata in poche ore e avrà validità per 48 ore dall’ora del prelievo. Nei casi di guarigione da COVID-19 la Certificazione sarà generata entro il giorno seguente e avrà validità per 180 giorni (6 mesi);;;
Nei casi di seconda dose o dose unica per pregressa infezione: avrà validità per 270 giorni dalla data di somministrazione. Nei casi di vaccino monodose: la Certificazione sarà generata dal 15° giorno dopo la somministrazione e avrà validità per 270 giorni;;;
Per quanto tempo è valida la Certificazione? In caso di vaccinazione: per la prima dose dei vaccini che ne richiedono due, avrà validità dal 15° giorno dopo la somministrazione e fino alla dose successiva;;;
Se non si è in possesso della Tessera sanitaria, dal sito https://t.co/ZWASPwSu3a è possibile recuperare la Certificazione, inserendo il codice ricevuto (SMS o email) insieme al numero del documento, comunicato dopo il tampone o quando è stato emesso il certificato di guarigione;;;
Posso acquisire la Certificazione se non ho pc o cellulare? Sì, è possibile rivolgersi, fornendo il proprio Codice Fiscale e Tessera Sanitaria, al proprio medico di base o in farmacia, i quali potranno o stampare la Certificazione con il QR Code o inviarlo ad un indirizzo email;;;
"La #CertificazioneVerde si può ottenere tramite modalità digitali:
??APP Immuni
??Sito https://t.co/ZWASPwSu3a, anche utilizzando l’identità digitale (SPID/CIE)
??Fascicolo sanitario elettronico, accedendo al proprio Fascicolo sanitario regionale";;;
Quando si può ottenere? Il sito https://t.co/ZWASPwSu3a è online, tutte le certificazioni associate alle vaccinazioni effettuate fino al 17/06 saranno rese disponibili entro il 28/06. La piattaforma informatica nazionale sarà progressivamente allineata con le nuove vaccinazioni;;;
È possibile acquisire la #CertificazioneVerde tramite modalità digitali e fisiche. La disponibilità della Certificazione viene comunicata tramite email o SMS (ai contatti indicati in fase di prestazione sanitaria: vaccinazione, test o guarigione) con un codice per scaricarla;;;
"Chi può ottenere la #CertificazioneVerde? 
??chi ha effettuato la prima dose o il vaccino monodose da 15 giorni
??chi ha completato il ciclo vaccinale
??chi è negativo a un tampone molecolare o rapido nelle 48 ore precedenti
??chi è guarito dal COVID-19 nei sei mesi precedenti";;;
Dal 1° luglio la #CertificazioneVerde COVID-19 sarà valida come #EUCOVIDCertificate e renderà più semplice viaggiare in sicurezza da e per tutti i Paesi dell'Unione Europea ??????;;;
Il Presidente Draghi ha firmato il Decreto che definisce le modalità di rilascio della #CertificazioneVerde COVID-19: faciliterà la partecipazione a eventi pubblici, l’accesso alle RSA e gli spostamenti sul territorio nazionale https://t.co/jdB5CIxelH;;;
È in corso a Palazzo Chigi la riunione del Consiglio dei Ministri n. 24. Qui l'ordine del giorno?? https://t.co/4rrXkHmydW;;;
Il Presidente Mario Draghi ha avuto questa mattina un incontro a Palazzo Chigi con il segretario della Lega, @matteosalvinimi. Durante il colloquio sono stati passati in rassegna gli sviluppi positivi della situazione economica e le prospettive di ripresa e crescita del Paese;;;
"Il Presidente Draghi riceve a Palazzo Chigi il Presidente della Repubblica Tunisina, Kais Saied #Agenda #16giugno
Diretta https://t.co/v3TYy4Wr6f";;;
#Agenda ??? #16giugno Il Presidente Draghi incontra alle ore 15.30, a Palazzo Chigi, il Presidente della Repubblica Tunisina, Kais Saied;;;
L'intervento del Presidente Mario Draghi al #NATOSummit di Bruxelles https://t.co/ELhn22GqlM;;;
"Dichiarazione del Presidente Draghi prima di partecipare ai lavori del #NATOSummit
In diretta da Bruxelles https://t.co/KV33rI6hpx";;;
#Agenda ??? #14giugno Il Presidente Draghi partecipa a Bruxelles al #NATOSummit @NATO https://t.co/WW3xGTULRX;;;
"RT @G7 : G7 leaders have agreed a shared agenda for global action to #BuildBackBetter together.

Read the Carbis Bay G7 Summit Communiqué ??
https://t.co/weGcoJlvd2

???? ???? ???? ???? ???? ???? ???? ????

#G7UK";;;
In diretta la #ConferenzaStampa del Presidente Draghi al termine dei lavori del Vertice #G7UK https://t.co/0aVTpNAn32;;;
"Il Presidente Mario Draghi partecipa oggi alla giornata conclusiva del Vertice #G7UK. In programma le sessioni di lavoro dedicate al tema delle ""Società ed economie aperte"", alla lotta ai cambiamenti climatici e alla protezione della natura https://t.co/Q14vAJOfhC";;;
Il Presidente Draghi ha partecipato oggi ai lavori della seconda giornata del #G7UK. A margine del vertice, gli incontri bilaterali con @POTUS Joe Biden e il Primo Ministro del Canada @JustinTrudeau https://t.co/j4PQ91pMR5;https://pbs.twimg.com/media/E3thWdyXEAAL_6N.jpg;https://pbs.twimg.com/media/E3thZTiXEAUhPgw.jpg;https://pbs.twimg.com/media/E3thcrLXwAId47R.jpg
"""Con il Presidente Biden siamo d’accordo su molti temi: donne, giovani, difesa degli ultimi, diritti umani, diritti civili, diritti sociali e tutela dell’ambiente che è il tema chiave della nostra presidenza del G20""";;;
"Draghi: ""Il bilaterale con @POTUS è andato molto bene. Sin dalla formazione del governo sono stato molto chiaro che i due pilastri della politica estera italiana sono l’europeismo e l’atlantismo"" #G7UK https://t.co/JMdbHloBar";;;
#EURO2020, Draghi: Sono vicino nella passione di milioni di italiani per la nostra Nazionale ???? tutto il mio sostegno alle maglie azzurre guidate dal ct Roberto Mancini per gli Europei di calcio che avranno inizio stasera @Vivo_Azzurro;;;
Draghi al #G7UK: la crescita è il modo migliore per assicurare la sostenibilità dei #contipubblici. È necessario mantenere un quadro di politica di bilancio prudente nel lungo periodo, per rassicurare gli investitori e evitare politiche restrittive da parte delle banche centrali.;;;
