Text;;;
Giovedì 25 aprile, Anniversario della Liberazione, tutti i #museitaliani resteranno aperti e grazie all'iniziativa #iovadoalmuseo molti luoghi potranno essere visitati gratuitamente. L’elenco sul sito del @_MiBAC https://t.co/wMDeZrzUVP https://t.co/vAy0L4xjdN;;;
"Il Presidente @GiuseppeConteIT ha presieduto il secondo incontro del Tavolo Istituzionale per il ""Contratto Istituzionale di Sviluppo per l’area di Foggia"". Il comunicato stampa: https://t.co/GO0SMifXp4";;;
RT @GiuseppeConteIT : Very friendly and fruitful exchange of views with PM @AbeShinzo today in Rome. We share the same positions on global issues ahead of the #G20OsakaSummit and we are both determined to strengthen our bilateral economic, scientific and cultural cooperation ?????????? https://t.co/UTb0ftJBBe;;;
RT @JPN_PMO : Prime Minister Abe and Prime Minister Conte of Italy held a session for joint press announcement. The two leaders reaffirmed their cooperation towards G20 Osaka meeting on key global issues including climate change, free trade, free and open Indo-Pacific and connectivity. https://t.co/094gv3Ohwp;https://pbs.twimg.com/media/D46mpr5W4AEPcjE.jpg;https://pbs.twimg.com/media/D46mp1YWsAAWcjn.jpg;
RT @JPN_PMO : Prime Minister Abe is welcomed by Prime Minister Conte of Italy at his office, and receives guard of honor. The two leaders then proceeded to the meeting to discuss bilateral and global issues to promote further cooperation towards the G20 Osaka meeting in June. https://t.co/dfdFMkhdbM;https://pbs.twimg.com/media/D46YlNLWkAEtK5J.jpg;https://pbs.twimg.com/media/D46YlMpWAAEBhIO.jpg;
"Dichiarazioni alla stampa del Presidente @GiuseppeConteIT e del Primo Ministro del Giappone @AbeShinzo
?? Diretta https://t.co/5gW7BT89zB";;;
Il comunicato stampa del Consiglio dei Ministri n. 56: https://t.co/GBWsgZXv8F;;;
Il Presidente @GiuseppeConteIT incontrerà domani, mercoledì 24 aprile, il Rappresentante Speciale del Segretario Generale dell’Onu per la Libia, Ghassan Salamé https://t.co/MyKjVnPAo7;;;
"Il Consiglio dei Ministri è convocato questa sera alle ore 19.00. 
Qui l'ordine del giorno: https://t.co/DRTNXudgIx";;;
Capitanata di Foggia, domani, 24 aprile, la seconda riunione del Tavolo istituzionale per il Contratto di sviluppo https://t.co/xaU37pYYTZ;;;
"Nella giornata di mercoledì 24 aprile, il Presidente @GiuseppeConteIT incontrerà alle ore 12 a Palazzo Chigi, il Primo Ministro del Giappone Shinz? Abe
https://t.co/tWw1dDREI3";;;
RT @GiuseppeConteIT : Nella domenica di Pasqua la notizia degli attentati in #SriLanka contro Chiese, fedeli e turisti mi coglie addolorato e sinceramente preoccupato da questa nuova deriva d’odio. Dal Governo italiano un pensiero alle famiglie di queste vittime innocenti e ai feriti;;;
L'intervista del Presidente @GiuseppeConteIT al Corriere della Sera: https://t.co/HZvQ7CMNr6;;;
"RT @GiuseppeConteIT : Congratulations to PM @netanyahu for being tasked by @PresidentRuvi with forming a new government! In the year of the 70th anniversary of diplomatic relations between #Italy and #Israel, I look forward to continuing to strengthen our strategic partnership &amp; true friendship ??????????";;;
RT @GiuseppeConteIT : Vogliamo ricostruire quel capitale di fiducia che i cittadini nutrono nella vita comune e nella società, senza il quale non è possibile generare crescita e sviluppo. Solo così i nostri figli non saranno più costretti a lasciare la terra che amano per costruirsi un futuro https://t.co/ALDbaNLTYz;;;
Il comunicato stampa del Consiglio dei Ministri n. 55 che si è svolto a Reggio Calabria https://t.co/PM7ESBOAJ1;;;
"Libia, informativa del Presidente @GiuseppeConteIT 
?? In diretta dal Senato https://t.co/lKnQdlQlV7";;;
RT @GiuseppeConteIT : Approvato oggi in Cdm qui a Reggio il #DecretoCalabria. Restituiamo ai cittadini di questa regione un diritto per troppo tempo negato, quello alla Salute. E continuiamo a lavorare per ripristinare legalità, efficienza, merito e trasparenza nel mondo della sanità pubblica https://t.co/ehUli2fndz;;;
"Il Presidente @GiuseppeConteIT e il Ministro @GiuliaGrilloM5S in conferenza stampa al termine del Consiglio dei Ministri n. 55 
?? In diretta da Reggio Calabria https://t.co/uJwDyRiAbo";;;
La lettera del Presidente @GiuseppeConteIT a Il Quotidiano del Sud: https://t.co/GBgUZc8bfc;;;
RT @GiuseppeConteIT : Oggi ho avuto un colloquio telefonico con il Presidente degli Stati Uniti @realDonaldTrump. Tema principale della conversazione la situazione libica sulla quale abbiamo condiviso la preoccupazione per l’escalation sul terreno e i rischi di una crisi umanitaria. https://t.co/NDbMJYF10G;;;
RT @GiuseppeConteIT : Come avevo anticipato qualche giorno fa, domani il Consiglio dei Ministri si riunirà a Reggio Calabria. Non si tratta di un’iniziativa esclusivamente simbolica, ma di un atto concretamente operativo che porterà all’approvazione di misure urgenti in tema di sanità. https://t.co/HSNHc0FZuk;;;
"C'è tempo fino al 30 aprile per aderire alla ""definizione agevolata"" e mettersi in regola con il pagamento delle cartelle. Con la ""rottamazione-ter"" e il ""saldo e stralcio"" puoi pagare in misura agevolata e con rate fino a cinque anni. Scopri come su @AE_Riscossione https://t.co/pEWtJYwMIR";;;
Il Consiglio dei Ministri è convocato per giovedì 18 aprile alle ore 13 presso la Prefettura di Reggio Calabria. Qui l'ordine del giorno e gli accrediti stampa: https://t.co/IBcAs5WVRn;;;
Il Presidente @GiuseppeConteIT ha partecipato ai funerali del Maresciallo Maggiore dei Carabinieri Vincenzo Carlo Di Gennaro, che si sono svolti questo pomeriggio a San Severo, in provincia di Foggia https://t.co/nnznjzc0F3;;;
RT @GiuseppeConteIT : Oggi a San Severo (Foggia) abbiamo rivolto l’ultimo saluto al Maresciallo Maggiore dei Carabinieri Vincenzo Carlo Di Gennaro, caduto in servizio pochi giorni fa. Onoriamo un servitore dello Stato, un uomo stimato e benvoluto da tutti https://t.co/FX8NY04ErZ;;;
#PensioneDiCittadinanza come funziona e cosa c’é da sapere. È possibile presentare la domanda negli Uffici postali, ai Caf o sul sito https://t.co/sAAaP6YxJC https://t.co/0yYsgdu504;;;
"Questa mattina il Presidente @GiuseppeConteIT è intervenuto al lancio del videogioco “Cybercity Chronicles"", realizzato dal Dipartimento delle informazioni per la sicurezza in collaborazione con il @MiurSocial https://t.co/ndiZ2ZNduv";;;
RT @GiuseppeConteIT : Una lezione speciale questa mattina con gli alunni dell’Istituto Regina Margherita. Una bella occasione di confronto per parlare di sicurezza digitale, cyber bullismo e rispetto della privacy https://t.co/uuT8RTFw2p;https://pbs.twimg.com/media/D4R_VNgW4AAV13i.jpg;https://pbs.twimg.com/media/D4R_VNhXkAYiwHo.jpg;https://pbs.twimg.com/media/D4R_VNqWsAAFY28.jpg
"Punto stampa del Presidente @GiuseppeConteIT
?? Diretta https://t.co/eCEHh1HMGY";;;
"Presentazione del videogioco “Cybercity Chronicles”, realizzato dal Dipartimento delle informazioni per la sicurezza  in collaborazione con il @MiurSocial
?? Diretta https://t.co/LfOMQDsFhp";;;
Il Presidente @GiuseppeConteIT ha incontrato in serata a Palazzo Chigi il Vice Presidente del Consiglio presidenziale libico, Ahmed Maitig. Qui il comunicato stampa: https://t.co/1xPyGle95l;;;
RT @GiuseppeConteIT : Un coup au coeur pour les Français et pour nous tous les Européens #NotreDame https://t.co/W1kXifPvmo;;;
Il Presidente @GiuseppeConteIT ha incontrato oggi a Palazzo Chigi il Vice Primo Ministro e Ministro degli Esteri del Qatar, Mohammed Al-Thani, per un confronto sulla situazione in Libia. Qui il comunicato stampa: https://t.co/TA8bpFNSAH;;;
"Libia, dichiarazioni alla stampa del Presidente @GiuseppeConteIT 
?? Diretta https://t.co/F9pkMII1tJ";;;
"Contratto istituzionale di sviluppo per il Molise, il Presidente @GiuseppeConteIT a Campobasso 
?? Diretta https://t.co/iCGrpqfuBt";;;
"Punto stampa del Presidente @GiuseppeConteIT 
?? In diretta da Campobasso https://t.co/1HYFxCnPi1";;;
Uso consapevole del web, il Presidente @GiuseppeConteIT domani, martedì 16 aprile, interverrà al lancio del videogioco “Cybercity Chronicles”, realizzato dal Dipartimento delle informazioni per la sicurezza in collaborazione con il @MiurSocial https://t.co/ndiZ2ZNduv;;;
"RT @GiuseppeConteIT : Qualche giorno fa, mentre ero a Brescia, ho fatto visita al professore Emanuele Severino, un punto di riferimento della filosofia teoretica a livello internazionale. Da quel dialogo è nata l’idea di ricavare un’intervista che trovate qui: https://t.co/NgTz8FnA7B 
Buona domenica! https://t.co/Aup6gR5Gdr";;;
RT @GiuseppeConteIT : Un abbraccio a Pasquale Casertano, il carabiniere che questa mattina è rimasto ferito nell’agguato di Cagnano Varano. È ora affidato alle premurose e professionali cure del personale sanitario della Casa Sollievo della Sofferenza, di San Giovanni Rotondo https://t.co/EoRLcUtk2T;;;
RT @GiuseppeConteIT : A Foggia per stringere in un abbraccio i familiari del maresciallo Vincenzo Di Gennaro, ucciso questa mattina a Cagnano Varano. Un servitore dello Stato colto di sorpresa e caduto in servizio, nel pieno esercizio delle sue funzioni. https://t.co/dJOQF8Z7zy;;;
L'intervista del Presidente @GiuseppeConteIT  a Il Fatto Quotidiano https://t.co/2TMskZXgl0;;;
"Punto stampa del Presidente @GiuseppeConteIT
?? In diretta da Bari https://t.co/pBQnOyr3Sr";;;
?? Diretta dell'intervento del Presidente @GiuseppeConteIT alla cerimonia inaugurale dell’Anno Accademico 2018-2019 del Politecnico di Bari https://t.co/7VG8hxT10z;;;
La lettera del Presidente @GiuseppeConteIT a La Gazzetta del Mezzogiorno https://t.co/RpqRfr4CjS;;;
RT @GiuseppeConteIT : Domani intensa giornata di impegni a Bari, ecco gli appuntamenti https://t.co/EszaTYEJZy;;;
"Il Presidente @GiuseppeConteIT ha ricevuto, a Palazzo Madama, il XIX Premio ""Donato Menichella"". Le foto, il video e il testo dell'intervento: https://t.co/7Q7LSGqbwn";;;
"Il Presidente @GiuseppeConteIT interviene al XIX Premio ""Donato Menichella"" 
?? In diretta da Palazzo Madama https://t.co/zmIMu4Acb4";;;
Il Presidente @GiuseppeConteIT lunedì 15 aprile sarà a Campobasso dove, alle ore 12, interverrà a un incontro presso la Prefettura in relazione al Contratto istituzionale di sviluppo per il Molise https://t.co/EnD7B3VkJ4;;;
RT @GiuseppeConteIT : Il nostro connazionale Sergio Favalli, rapito in Nigeria il 30 marzo scorso, sta rientrando in Italia. Ancora un ringraziamento speciale ai nostri servizi di intelligence, in particolare all'AISE, per il fondamentale lavoro svolto che ha portato a questo brillante risultato;;;
Il Presidente @GiuseppeConteIT è intervenuto alla Camera per riferire sui recenti sviluppi della situazione in Libia. Il video dell’intervento: https://t.co/9T15ne0NR0 https://t.co/pmrU9YbM9X;;;
"Situazione in Libia, informativa urgente del Presidente @GiuseppeConteIT
?? in diretta dalla Camera dei Deputati https://t.co/DP98Exqrmz";;;
"Il Presidente @GiuseppeConteIT interviene alla presentazione del primo rapporto ""Cinema e audiovisivo: l’impatto per l’occupazione e la crescita in Italia"" 
?? Diretta https://t.co/7nJlg2tuZZ";;;
"Il Sottosegretario Giancarlo Giorgetti presenta la 76esima edizione degli Internazionali BNL d'Italia del tennis #IBI19
?? in diretta da Palazzo Chigi https://t.co/i9OtSCBfrH";;;
Gli impegni del Presidente @GiuseppeConteIT per la giornata di giovedì 11 aprile: https://t.co/lKYCX0l4ps;;;
"Punto stampa del Presidente @GiuseppeConteIT prima di partecipare al Consiglio europeo Art. 50 #EUCO
?? In diretta da Bruxelles https://t.co/BITb28Ej6q";;;
Domani, giovedì 11 aprile, il Sottosegretario Giorgetti presenterà a Palazzo Chigi la 76esima edizione degli Internazionali BNL d'Italia del tennis #IBI19. L'evento sarà trasmesso in diretta su https://t.co/Ay5IlDmUOE e sui canali social di Palazzo Chigi https://t.co/E4lswy090F;;;
Brexit, il Presidente @GiuseppeConteIT partecipa a Bruxelles, alle ore 17, al Consiglio europeo straordinario Art. 50 #EUCO https://t.co/TgFd0l4RT8;;;
Il Presidente @GiuseppeConteIT ha incontrato a Palazzo Chigi il Presidente della Repubblica del Sud Sudan, Salva Kiir Mayardit https://t.co/wVWC3Olv4S;;;
Questa mattina la @poliziadistato celebra i 167 anni dalla fondazione. A tutti gli uomini e le donne al servizio dei cittadini, i nostri migliori auguri #AnniversarioPolizia #essercisempre https://t.co/KaHmw1fGhN;;;
Il comunicato stampa del Consiglio dei Ministri n. 54: https://t.co/CkC0Zc2s6q;;;
Il Presidente @GiuseppeConteIT, a Milano, è intervenuto all'inaugurazione del 58° Salone internazionale del Mobile e della Torre Generali. Le foto e i video: https://t.co/twT7bKb0gv https://t.co/9dqPo3MyBB;https://pbs.twimg.com/media/D3t_K7rWsAE9n7A.jpg;https://pbs.twimg.com/media/D3t_Ng1XoAAOujN.jpg;
?? In diretta dalla fiera di Milano, l'intervento del Presidente @GiuseppeConteIT all'inaugurazione del 58° Salone internazionale del Mobile https://t.co/TbD8j6FuJJ;;;
Il Presidente @GiuseppeConteIT è in visita a Milano. In mattinata interverrà  all'inaugurazione del 58° Salone internazionale del Mobile presso la Fiera di Milano - Rho. Successivamente, sarà all'inaugurazione della Torre Generali. https://t.co/twT7bKb0gv;;;
Il Presidente @GiuseppeConteIT è intervenuto all'inaugurazione del Museo Permanente del Design italiano, alla Triennale di Milano. Le foto e i video dell’intervento e del punto stampa: https://t.co/5VdKQRrl0u;;;
"Il Consiglio dei Ministri è convocato domani, martedì 9 aprile, alle ore 16.30. 
Qui l'ordine del giorno: https://t.co/acSqnLwlJR";;;
"Punto stampa del Presidente @GiuseppeConteIT 
?? in diretta da Milano https://t.co/ijkI9bQzzd";;;
"Il Presidente @GiuseppeConteIT interviene all'inaugurazione del Museo Permanente del Design italiano
?? in diretta da Milano https://t.co/MmDHyt10uh";;;
Al via la prenotazione degli incentivi per l’Ecobonus, la misura promossa dal @MISE_GOV per l’acquisto di veicoli a ridotte emissioni di CO2, come previsto dalla Legge di Bilancio 2019  https://t.co/nj0Qe4VsVw;;;
"Si è insediato a Palazzo Chigi il Tavolo per il ""Contratto istituzionale di sviluppo per l’area di Foggia"". Istituito con decreto del Presidente @GiuseppeConteIT, il Tavolo dovrà elaborare strategie per lo sviluppo e la valorizzazione della Capitanata https://t.co/dufSimLxDv";;;
Il Presidente @GiuseppeConteIT è stato al Salone internazionale del vino a Verona #Vinitaly2019 https://t.co/gSrsy51EXE;;;
RT @GiuseppeConteIT : Un giro a bordo della mitica Ferrari 250 GT della @poliziadistato che negli anni Sessanta è diventata famosa grazie anche a un pilota d’eccezione, il brigadiere Armando Spatafora. Parliamo di eccellenze italiane! ???? https://t.co/G48yOTa8Dv;;;
RT @GiuseppeConteIT : #Vinitaly2019, che bella accoglienza! https://t.co/QamqlBkYdP;;;
Gli appuntamenti del Presidente @GiuseppeConteIT dal 7 al 12 aprile https://t.co/o9tzkAMtFY;;;
Libia, nota della Presidenza del Consiglio https://t.co/eSaBPmR8b2;;;
RT @GiuseppeConteIT : La ferita di una comunità locale è una ferita della comunità nazionale. Sono passati 10 anni dal sisma a #LAquila e ancora oggi abbiamo il dovere della memoria: tanti hanno perso persone care, in molti continuano a soffrire. A loro mi stringo con un caloroso, sentito abbraccio https://t.co/cpjCfsVETd;https://pbs.twimg.com/media/D3dGrVrW4AIbs6V.jpg;https://pbs.twimg.com/media/D3dGrVkXsAA4AM9.jpg;https://pbs.twimg.com/media/D3dGrVmXkAA1FF0.jpg
RT @GiuseppeConteIT : A conclusione di una complessa e delicata attività di intelligence, investigativa e diplomatica, condotta in maniera sinergica, in data odierna siamo riusciti a ottenere la liberazione di Sergio Zanotti, rapito in Siria nell’aprile 2016. https://t.co/RShcODYUye;;;
Il comunicato stampa della riunione del Cipe del 4 aprile: https://t.co/ovL9lqBf7a;;;
Olimpiadi invernali 2026, la nota del Presidente @GiuseppeConteIT: https://t.co/UpzY3vSNDq;;;
Firmato dal Ministro @luigidimaio il Decreto che sblocca le risorse per circa 60.000 lavoratori delle 18 aree di crisi complessa https://t.co/ZgXGoH6VLw;;;
Brexit, a Palazzo Chigi si è tenuta la settima riunione della task force. Aggiornato il documento con tutte le informazioni utili sulle conseguenze di un'uscita senza accordo, settore per settore https://t.co/OPY5SBHuj3;;;
"Il Presidente @GiuseppeConteIT interviene al Family Business Festival
?? in diretta da Brescia https://t.co/v6JsGLbBg0";;;
Il comunicato stampa del Consiglio dei Ministri n. 53: https://t.co/ydMCQhZzve;;;
Libia, la nota del Presidente @GiuseppeConteIT: https://t.co/WWj7vgPzwP;;;
"Il Presidente @GiuseppeConteIT, in visita alla Comunità di San Patrignano, è intervenuto al Forum sull'Economia Sostenibile. In seguito, a Fabriano, ha visitato i cantieri del Quadrilatero Marche-Umbria in località Borgo Tufico. 
Qui le foto e i video: https://t.co/zQbk3zzFRb https://t.co/722rxvHGPb";https://pbs.twimg.com/media/D3UWIvbW4AIk3Sr.jpg;https://pbs.twimg.com/media/D3UWKDfXkAAdSGy.jpg;https://pbs.twimg.com/media/D3UWLFeWAAET_ON.jpg
RT @GiuseppeConteIT : Cambiamento, nella sua essenza, significa cercare in tutti i modi, con tutte le energie, di invertire la rotta rispetto a un modello di sviluppo iniquo e insostenibile. E avete la mia parola che mi impegnerò fino all’ultimo affinché questo cambiamento si realizzi concretamente https://t.co/rKsKNZYmKg;;;
"Il Presidente @GiuseppeConteIT interviene al Forum sull'Economia Sostenibile #SEF2019
?? in diretta dalla Comunità di San Patrignano https://t.co/BciYcLwyZn";;;
Il Consiglio dei Ministri è convocato oggi alle ore 16.00. Qui l'ordine del giorno: https://t.co/bF4yhLHjNf;;;
"Domani, giovedì 4 aprile, il Presidente @GiuseppeConteIT interverrà al Forum sull'Economia Sostenibile (Comunità di San Patrignano). In seguito sarà a Fabriano (Ancona) dove visiterà i cantieri del Quadrilatero Marche-Umbria
https://t.co/zQbk3zzFRb";;;
"Il Presidente @GiuseppeConteIT è stato in visita ufficiale a Doha, nel Qatar. 
Tutte le foto e il video dell’incontro con la stampa: https://t.co/QpSFNP08P7 https://t.co/Kl6rlheMO7";;;
"RT @GiuseppeConteIT : A great pleasure to meet @tamimBinHamad today in Doha. Lots of opportunities for our partnership. Forward looking with innovation and culture together
?????????? https://t.co/TYNc7rlBqi";;;
"Punto stampa del Presidente @GiuseppeConteIT 
?? In diretta da Doha https://t.co/ote7qfDv7K";;;
"Gli impegni del Presidente @GiuseppeConteIT da giovedì 4 a domenica 7 aprile:
https://t.co/GzUkzwzMc3";;;
Il Presidente @GiuseppeConteIT ha incontrato il Segretario Generale dell’Ocse Angel Gurrìa https://t.co/hzT601hJs5 https://t.co/LTDoFC945K;;;
Il Presidente @GiuseppeConteIT ha incontrato a Palazzo Chigi il Presidente della Commissione europea @JunckerEU. Qui le foto e il video delle dichiarazioni alla stampa: https://t.co/E1uPFIGSRr;;;
"Dichiarazioni alla stampa congiunte del Presidente @GiuseppeConteIT e del Presidente della Commissione europea @JunckerEU 
?? Diretta https://t.co/DomlfI70CQ";;;
RT @GiuseppeConteIT : Esprimo piena solidarietà alla sindaca di Torino @c_appendino, vittima di un gravissimo atto intimidatorio. L’intero governo è al suo fianco. Lo Stato non permetterà che minacce del genere le impediscano di esercitare appieno il suo ruolo;;;
On line il bando “FERMENTI”: 16 milioni di euro destinati ai giovani per iniziative imprenditoriali di natura sociale e coesiva che migliorino le condizioni della collettività. Tutte le informazioni sul sito dedicato: https://t.co/oXAlXvQCIB https://t.co/BotGjkmbBD;;;
Scuola digitale: a Genova dal 4 al 6 aprile la prima tappa di Futura, l’evento organizzato dal @MiurSocial con incontri, laboratori e gare di idee #FuturaItalia https://t.co/eQT6EHmXaJ;;;
Il Presidente @GiuseppeConteIT incontra oggi a Palazzo Chigi alle 18.45 il Presidente della Commissione europea @JunckerEU https://t.co/E1uPFIGSRr;;;
Il Presidente @GiuseppeConteIT è intervenuto al @fnecfestival a Firenze. Foto e video della giornata: https://t.co/a5hhR6eUGd https://t.co/hW6lzSW65A;;;
RT @GiuseppeConteIT : Bel pomeriggio insieme nella campagna fiorentina. Bene le parole e le discussioni, rispettando ognuno le idee dell’altro, ma non perdiamo mai di vista la “ragione sociale” per cui siamo al governo: lavoriamo con la massima concentrazione per gli interessi degli italiani. https://t.co/i7yq3oLTLJ;;;
"Punto stampa del Presidente @GiuseppeConteIT 
?? In diretta da Firenze https://t.co/kMvytMUmvb";;;
"L’intervento del Presidente @GiuseppeConteIT al Festival Nazionale dell’Economia Civile
?? In diretta da Firenze https://t.co/SgKlFyV9OD";;;
Stasera le luci delle facciate di Palazzo Chigi saranno spente tra le 20:30 e le 21:30. Con questa azione simbolica, la Presidenza del Consiglio aderisce a #EarthHour, l'iniziativa globale per richiamare l'attenzione sui cambiamenti climatici https://t.co/QlBKrioa43;;;
#OggiProtagonisti, domani a Roma 600 ragazzi provenienti da tutta Italia discuteranno di futuro. All'evento interverranno il Vice Presidente @luigidimaio e il Sottosegretario Vincenzo Spadafora https://t.co/0iMjDXgY5k;;;
Gli impegni del Presidente @GiuseppeConteIT da domenica 30 marzo a mercoledì 3 aprile: https://t.co/iHHNPWh8kB;;;
Il Presidente @GiuseppeConteIT è stato ad Assisi per la consegna della Lampada della Pace al Re Abdullah II di Giordania. Al termine della cerimonia, insieme alla Cancelliera Angela Merkel e al Re Abdullah II è intervenuto all'incontro con i giovani https://t.co/fKgn2xQila;;;
"Assisi, il Presidente @GiuseppeConteIT incontra i giovani
?? Diretta https://t.co/IG6jMG78tn";;;
"Punto stampa del Presidente @GiuseppeConteIT da Assisi https://t.co/FzIguGKr3Z
?? Diretta";;;
Nella giornata di domani, venerdì 29 marzo, il Presidente @GiuseppeConteIT sarà ad Assisi per partecipare all’incontro con i giovani in occasione della consegna della Lampada della Pace al Re Abd Allah II di Giordania https://t.co/Q7XRuqNtqB;;;
A Palazzo Chigi la cerimonia di consegna delle Onorificenze dell'OMRI con il Sottosegretario Giorgetti. Tra gli insigniti il primatista di atletica leggera @FilippoTortu e Giuseppe Ottaviani il primo centenario a fare il salto triplo nella categoria master https://t.co/4qywvnEu5B https://t.co/ujhOgfwMGQ;https://pbs.twimg.com/media/D2sEJGzWsAESgWX.jpg;https://pbs.twimg.com/media/D2sEKLXX0AAhmMy.jpg;https://pbs.twimg.com/media/D2sEN4nXQAAK-k-.jpg
RT @GiuseppeConteIT : È un giorno importante per l'Italia. Reddito di Cittadinanza e Quota 100 sono a tutti gli effetti realtà. Dal Senato l’ok definitivo. Grazie alle due misure qualificanti del nostro Contratto di Governo diamo speranza e dignità a milioni di italiani. Un'altra promessa mantenuta!;;;
Il comunicato stampa del Consiglio dei Ministri n. 52 https://t.co/nOJ4k6lOqp;;;
Il comunicato stampa del Consiglio dei Ministri n. 51: https://t.co/2fhdzE8leR;;;
Il Consiglio dei Ministri è convocato oggi alle ore 15.30. Qui l'ordine del giorno: https://t.co/Trd7l6o0Qj;;;
L’intervista del Presidente @GiuseppeConteIT al Corriere del Mezzogiorno https://t.co/ue1RU9KKdu;;;
?? Diretta dell'intervento del Presidente @GiuseppeConteIT alla presentazione del libro “La Chiesa in Cina. Un futuro da scrivere” https://t.co/eTCDODr359;;;
Il Presidente @GiuseppeConteIT ha partecipato alla cerimonia commemorativa del 75° anniversario dell’eccidio delle Fosse Ardeatine https://t.co/IpSKJuslmQ https://t.co/NUwZ9e06g0;;;
Il Presidente @GiuseppeConteIT è intervenuto alla cerimonia di apertura degli #StatiGeneraliEditoria: https://t.co/0beseihVy5;;;
L'intervista del Presidente @GiuseppeConteIT a La Stampa https://t.co/hQR3OJVoox;;;
"Il Presidente @GiuseppeConteIT interviene agli #StatiGeneraliEditoria
?? Diretta https://t.co/KBAg8eydjD";;;
RT @GiuseppeConteIT : Dopo le cinque medaglie e i due titoli mondiali, per la prima volta l'Italia vince la Coppa del Mondo di #biathlon. Complimenti a Dorothea Wierer per questo straordinario traguardo. Brava anche Lisa Vittozzi, seconda. Un anno indimenticabile per il biathlon italiano ?????? https://t.co/otNdAVbhZN;https://pbs.twimg.com/media/D2ctskFXcAIBMM0.jpg;;
Questa mattina il Presidente @GiuseppeConteIT, a Lecce per la cerimonia di firma dell'accordo tra Cnr ed Eni per la realizzazione di quattro laboratori nel Sud d'Italia, ha incontrato alcuni olivicoltori danneggiati della xylella. Qui le foto e i video: https://t.co/H0ROL7Accx https://t.co/VoLPCyEC8P;https://pbs.twimg.com/media/D2cWrjqWwAAsWIB.jpg;https://pbs.twimg.com/media/D2cWuCBWkAAzEPF.jpg;https://pbs.twimg.com/media/D2cWwtCWoAIF4p9.jpg
RT @GiuseppeConteIT : Lavoriamo per il riscatto del Sud. Tutti insieme. Senza distinzioni di colori politici, senza tenere conto delle distanze geografiche. Se riparte il Sud riparte l’Italia: https://t.co/iUavvjdxCB https://t.co/c8yZeaR8SH;https://pbs.twimg.com/media/D2cDQnWXcAAb98v.jpg;https://pbs.twimg.com/media/D2cDQnSXcAEDpU5.jpg;https://pbs.twimg.com/media/D2cDQm5XgAEwaDu.jpg
RT @GiuseppeConteIT : Oggi ricordiamo i 335 innocenti trucidati 75 anni fa dalle truppe naziste alle #FosseArdeatine. Una delle pagine più tragiche della nostra storia che abbiamo il dovere di ricordare per onorare la memoria delle vittime e dei loro familiari, ma anche per trarre monito per il futuro;;;
?? Punto stampa del Presidente @GiuseppeConteIT a Lecce https://t.co/z2kftCpbZg;;;
"Intervento del Presidente @GiuseppeConteIT in occasione della firma dell'accordo ""Laboratori congiunti Cnr/Eni""
?? In diretta da Lecce https://t.co/2beSNb9hoL";;;
Gli impegni del Presidente @GiuseppeConteIT da domenica 24 a venerdì 29 marzo: https://t.co/ta6wnWOQBz;;;
Il Presidente @GiuseppeConteIT domani, alle ore 11.30, interverrà a Lecce alla firma dell’accordo “Laboratori congiunti Cnr/Eni” https://t.co/H0ROL7Accx;;;
